,_unit_id,text,description,gender
393,18573995,How We Increased #GenderDiversity In Our Boardroom https://t.co/GEpI8PGcFH #women,"Fostering #diversity and #inclusion through events, networking and education. Certified #BCorp",female
394,928508143927267329,"The Abby-D by Bogner Fire + Ice in black is a lightweight, fitted down jacket.
#fashion #women #trends #styles… https://t.co/cmt79vjOyw", ,female
395,817780680134422530,#KarniSena is #disrespecting #SupremeCourt &amp; threatening #children &amp; #women https://t.co/tRy4WAAXpI,"Associate Professor - radio host globaldesiworldnwomen, researcher - South Asian women, advocacy 4 women's rights. in love wt India, the nation, Jai Bhagwati!",female
396,1461039097,"Let's connect

 SOWBO Magazine March editon https://t.co/9K8vSk3lv6 #WOMEN","Author/Coach, Business Owner, Registered nurse.  My key words for life are “Keep it Moving” those are the words I have lived my life by. I  live in",female
397,1461039097,Coming to your city connect with us: https://t.co/3JzID79NQu   #SOWBO #Women,"Author/Coach, Business Owner, Registered nurse.  My key words for life are “Keep it Moving” those are the words I have lived my life by. I  live in",female
398,1410477492,"She's pretty in #pink in her ASSASIN #women #fitness #leggings &amp; top 
myriel_atomikfit… https://t.co/55LTeB4gqe","Been playing guitar for over 22 years now,just started my new Guitar/Bass/Accessories/Clothing line called ASSASIN,watch out I'm Baaaaaaack!",female
399,60982728,"Planned Parenthood President to White Women: Do Better; Black
Women Can’t Keep Saving the Country  #WomensRights… https://t.co/ToNWBFI8hR",Wiah is a Ghedee Master with over 30 years of experience. The transformation of the Energetic structure is the foundation of true change and all manifestation.,female
400,891315848425734144,"Leg Avenue Teal Velvet Teddy Playsuit - Eyelash lace ...
https://t.co/c8eLn7IFWT

30% OFF Everything - Our Valentin… https://t.co/hcntkYEjcx","LIVE NOW!!   Our Passion is your Pleasure   #Male #Female #Couples #LGBT #Sex #Lesbian #Gay #BI #Trans #Hetro #lingerie #sextoys #sex Questions, Drop us a DM",female
401,39500848,4 paths to #retail transformation from #women empowering change @CVSHealth #HelenaFoulkes https://t.co/YqH4glocqj via @NRFnews,#Speaker| #Blogger| #Jarhead| #ChiefDiversityOfficer. All thoughts are my own & from my own thumbs.,female
402,43943938,"YESSSSSS!!! 😊😊😊😊😊😊😊

Exclusive: @labour confirms #SelfIdentifying #trans women are #women

Labour confirms its… https://t.co/kjaC33Rizz","#Feminist, #transgender & #witch. #Vegan, #queer & proud #socialist - girlfriend of @KennyLeeG83 #forthemanynotthefew #blacklivesmatter #myfooddoesntscream",female
403,858796250610774017,"Talk to someone about it... 
#Kaan #speakup #sayno2abuseng #talktosomeone #men #women #children https://t.co/JMvacoo0mx","To help protect lives against abuse, irrespective of gender and age by educating on abuse and help sorting for help where needed. We Care",female
404,837830638044647424,"ASBC Women In Excellence Invite you to join us! 🙏🏽 

TODAY - Wednesday Weekly Call-In Prayer @ 6:30-6:45pm 

☎Dial:… https://t.co/rwy3z59d09",The Queen Within: “Empowered to Walk in Power and Authority” Luke 10:19,female
405,829708165948268544,She really likes fucks https://t.co/bYW4jbdrTH ♥ @OJnaitis  #girl #women,#porn vids +18 #hardcore #sluts #sex,female
406,814383381542793216,#Women’sMarch –StraightIntoTheWhiteHouse, ,female
407,3036130224,"With well known Bollywood Actress Suzanne Bernert Mam @suzannebernert 

#Bollywood #Actress #BollywoodActress… https://t.co/iFq8UfS8MN","Jaipur based Young Junior Photo Journalist , Traveller and a Film Maker too",female
408,17605064,"@Amelia__Earhart When people tell me they #love &amp; care for me, I feel so loved. Especially when it's one of the… https://t.co/5YEAxxm0GW",Freelancer & passionate networker. My work makes yours easier. Interested in my services? Read my Personal Mktg Strategy paper. RT's may not be endorsements.,female
409,2391345684,"BLOOMFIELD: In the West, #Women Control Reproduction. They March to Uphold That Status - https://t.co/Kt8m3jiHyB","Founder of the Tea Party's Front Page. NRA, USN. Old school, not PC. Followed by @DocThompsonShow & @ETTalkShow. ΜΟΛΩΝ ΛΑΒΕ! (John 15:13.) https://t.co/6KcuJhU6nP",female
410,791740404546674688,"""Could my ideas flow as fast as the rain in the store closet it would be charming."" -#JaneAusten, from a #letter of… https://t.co/u8ywL2afdm","The Making of Jane Austen (2017), https://t.co/3ELbqDspJy, a Pub Weekly Best Summer Book (Nonfiction) by @devoneylooser, aka @stonecoldjane",female
411,4142915234,"Try to see a woman beyond their image as a daughter,wife or mother and you will see the unique and inspiring indivi… https://t.co/1giD8pcX7p",Find me where the expectations of perfection are irrelevant.,female
412,142600277,"#Poland celebrates 100th anniversary of regaining independence, but #freedom is obviously not for all. Polish… https://t.co/lzQIGuqpBh","We've been fighting bad guys since 1961. Follow us for #humanrights news, live event coverage and ways to make the world a better place. RT ≠ endorsement.",female
413,7589742,The latest The friends Daily! https://t.co/SWRnIEEU7T Thanks to @mikejny @Timberry #women #influencermarketing,"The Heartfelt Life: business coach, author, entrepreneur models productivity, life balance, learning & communication Book: https://t.co/U4b7tLwmHL",female
414,541176135,"Why we do what we do
MIND MOOD BODY &amp; FOOD
#business #women #confidence #bodyimage #2017 #you 
Click Link to listen… https://t.co/w34uDO8OVL","Funky, Mindfulness, Fitness, Yoga and Food. Getting your mind and body in fantastic shape. Home of the Project. Sorting things out. Making you happy. Fact",female
415,1849267530,"Comfort #Women no emotion, just logic
https://t.co/KkMDZ5DA5m
#Queens #NYC #BergenCounty #Losangeles #Fairfax #VA #Virginia #flushing",Angry at American Journalism and politicos,female
416,397464298,@jessphillips is absolutely right that #sexual #harrassment and #abuse against #women is unacceptable and indicativ… https://t.co/JyqvxkELw7,"University student studying history and politics. Special interest in Asian geopolitics, particularly China. Healthy living enthusiast. Aspiring diplomat.",female
417,416190030,"When looking to build a new #THATMuse treasure hunt at the #britishmuseum, this adorable duck - from the Three King… https://t.co/u5JeL8R8F2","THATMuse stands for “Treasure Hunt At The Museum”. Join us for a themed hunt at the Louvre, V&A, British Museum, Musée d'Orsay & on Paris Streets!",female
418,793119505077641218,"Coffee Till Cocktails Off Shoulder Sweater, #clothing #women @EtsyMktgTool https://t.co/qVCXadN0c1… https://t.co/Hx0uMM3W22", ,female
419,835118416231018496,"Oh my gosh is denied by me! https://t.co/d36eakFTZM 😋
@sandranorahs
 #women #girls #anal https://t.co/04f3h90q4d", ,female
420,2289893246,Alexa Slim Leggings #women #apparel #activewear #leggings #Alexa #slim https://t.co/cEcOsSFeyY https://t.co/gjOhc6erZO,"ClothesTogether Carries Products for the Whole Family. You will definitely find some of the Hottest, Trendiest products at https://t.co/U0Zht0Q3li.",female
421,311603106,Achenyo Idachaba  saw a harmful plant and turned it into profit &amp; environmental relief. https://t.co/SEvEnEubNX #Women #Entrepreneurs,ARMA provides a broad range of performance-based IT and professional services to various agencies within the U.S. Government and the private sector. IG @armainc,female
422,2933640272,"Insights from the #Davos! @Pat_Milligan1 sits down to reflect on @Mercer's #WhenWomenThrive breakfast, offering key… https://t.co/3Q5MA6mGo3",Associate Actuary working at #Mercer 🌍🇪🇬🇦🇪,female
423,794750847158722560,"#Female Devt: UN Women seeks partnership:

The @UN_Women  has called for partnership among government, private sect… https://t.co/nIWKPjlhm8",#MadameDigital Entrepreunariat à l'ère du #Numérique #SheGoesDigital Entrepreneurship in the #Digital era- Launched by Inter'Actes @Baantoucom Tweets FR&EN,female
424,793119505077641218,"Vacation Off Shoulder Sweater, Mom Sweater, #clothing #women @EtsyMktgTool https://t.co/J0DrNunA9o #yogasweater… https://t.co/jjN2w1dcLT", ,female
425,787644347072192513,SRH@62 Harem Pants Women Yoga Pants Drop Crotch #clothing #women #pants @EtsyMktgTool https://t.co/kJUK0ht5rV… https://t.co/HC2PPPeMSx,More of Thai harem pants & Thai culture products. Free shipping for order over $80. https://t.co/0c38rNizW9,female
426,2391345684,Labour’s internal battle over trans #women and All-Women Shortlists suggests its strategy of identity #politics is… https://t.co/kkmivZHq8j,"Founder of the Tea Party's Front Page. NRA, USN. Old school, not PC. Followed by @DocThompsonShow & @ETTalkShow. ΜΟΛΩΝ ΛΑΒΕ! (John 15:13.) https://t.co/6KcuJhU6nP",female
427,1166402822,"Chic Russian girls will show all ➡ https://t.co/qCGeVoOssx ⬅ 
#nsfw  #HappeningNow #WomenRights #Women #Girls… https://t.co/leZ8wdtmz6",I'll show my intimate video. Online Dating in #Moscow #sex #Dating,female
428,4119647465,@KPMG opens its program at @Davos by hosting a women’s networking event in partnership with Procter &amp; Gamble and th… https://t.co/8EHzgl4cDa,"KPMG Kawasmy & Partners in #Jordan is a member firm of KPMG Global, our experts specialize in providing high quality #Audit, #Tax & #Advisory services.",female
429,852057416493563904,"Look this whore!! https://t.co/w8RfXsGx8l 
@doty_rick
 #lesbian #women #girls https://t.co/ULLagBOrCB", ,female
430,891315848425734144,"Roxana Fishnet Mini Dress - Large holed fishnet dress ...
https://t.co/eOOhiSM58f

30% OFF Everything - Our Valenti… https://t.co/j7vpPIywvF","LIVE NOW!!   Our Passion is your Pleasure   #Male #Female #Couples #LGBT #Sex #Lesbian #Gay #BI #Trans #Hetro #lingerie #sextoys #sex Questions, Drop us a DM",female
431,2570987840,"I am tender and naughty, passionate and sensitive. I like to communicate with people, that...… https://t.co/HDmqlLPdA1", ,female
432,1569070813,[SALE] #women straw #bag summer beach shoulder shopping #bag made o https://t.co/2UxNyq2SqD visit our ebay store https://t.co/alMxVQDSY9,we sell on EBAY,female
433,22784904,ACOG's Dr. Tersh McCracken: The policy will only dissuade #pregnant #women grappling with addiction from seeking th… https://t.co/cENYCnEok8,The leading authority on women’s health care.,female
434,892415085854982152,This looks like a great program for #women in #Winnipeg. Check it out! https://t.co/A3oyq63hHM,"MYS fosters hope & opportunities to empower children, youth, adults & families throughout Manitoba to grow and heal. Offices in The Pas, Thompson, and Winnipeg.",female
435,4923212894,Thank you for supporting the women and children at the ROOTs Centre. With your generous donations and purchases of… https://t.co/KLVBYnpXnE,"ROOTS of South Sudan is Committed to Helping the Women of South Sudan Craft a New Nation.
Etsy https://t.co/HnyVpC6gWR
Facebook https://t.co/IeDmuLP1cB",female
436,3562941,Justin Trudeau tells Davos: tackle inequality or risk failure #WEForum #WEF2018 #Davos #Trudeau #leadership #women… https://t.co/5KaQqrxeiF,"Seattle-based mobile web developer interested in people, travel, film, culture, language, urban studies, and how tech shapes the way we communicate.",female
437,264883638,"Men, be on the lookout! #liberals want to make this mandatory for all #women. https://t.co/i1BMYr6wQp","Hi, I'm Dr. Stupid. I'm gonna take out your liver bones!

18th grader at NIU",female
438,36693755,Unify to Magnify. You can't miss this conversation at #WoPC with Adele: Bridging the Divide Between White &amp; Brown W… https://t.co/QiGkB8nqDz,YWCA Greater Cleveland is the leading organization in NE Ohio working to eliminate racism & empower women.,female
439,159107583,“Women Wage #Peace” #Women Are Saving the World Where Men Have Failed Spectacularly: https://t.co/ewznCpnwh9 https://t.co/8gnIFG7qEU,"Promoting #FeministPeace through the full and meaningful participation of women, conflict prevention, disarmament.",female
440,1043356164,The latest Women &amp; Africa Daily! https://t.co/76McKNGqM3 Thanks to @TimbuktuTexas @AAJWnewyorkcity @Blaaast_co #women #womenswednesday,Wer're building a better world for #women & #Africa 👩🏾🌍✝️ 📚🇨🇲🇺🇸Nous construisons un meilleur monde pour les #femmes et l'#Afrique,female
441,3036130224,"With well known Bollywood Actress Aditi Govitrikar mam @aditigovitrikar 

#Rajasthan #India #jaipur #traveller… https://t.co/J5fYGU6pD2","Jaipur based Young Junior Photo Journalist , Traveller and a Film Maker too",female
442,858796250610774017,"Talk to someone about it... 
#Kaan #speakup #sayno2abuseng #talktosomeone #men #women #children https://t.co/aYl1xzA7DO","To help protect lives against abuse, irrespective of gender and age by educating on abuse and help sorting for help where needed. We Care",female
443,712674450894954497,"Fall in #love with #FabulousFebruary @NakedHandsSpa #Deals &amp; #giveaways throughout #February 
#Ladies enjoy #2for1… https://t.co/5MQHPjLsG4","A friendly and relaxed clothes free spa in North London. Facilites - sauna, steam room, hot tub, massages also available.",female
444,713009729744797696,The Miracle At Speedy Motors  https://t.co/93xQ6eAMra #mcallsmith #ladies #alexandermcallsmith #detective #mystery,The best Scottish books #books #scotland #novels #reviews,female
445,3888926235,#Ladies #Leather Wallet with a pocket for #coins. #Soviet Tooled #Leather #Money Purse #giftideas #vintagefashion… https://t.co/BZTzAsHnt8,"Sell online, Check us out on  #ETSY and find what you've always dreamed of. We are on Pinterest https://t.co/TZ0lLWPW9F, facebook https://t.co/lJ26UKgIEM",female
446,3888926235,#Vintage #Ladies #Leather Wallet. #Retro #VintageAccessory  Tooled Leather Money Purse #giftideas #vintagefashion… https://t.co/yQG679nGgY,"Sell online, Check us out on  #ETSY and find what you've always dreamed of. We are on Pinterest https://t.co/TZ0lLWPW9F, facebook https://t.co/lJ26UKgIEM",female
447,3888926235,#Ladies #Leather #Wallet with a pocket for coins. #Vintage #Soviet #Retro Wallet. #Fashion #vintagefashion #ETSY https://t.co/IOVYXKKUAp,"Sell online, Check us out on  #ETSY and find what you've always dreamed of. We are on Pinterest https://t.co/TZ0lLWPW9F, facebook https://t.co/lJ26UKgIEM",female
448,21788213,"Fauna girl 3

#woman #ladies #copic #copicmarkers #blue #bigeyes #pretty #lady #style… https://t.co/Szmp8lo1RV",Freelance Graphic Designer and Dreamer,female
449,754830458089775104,To Shop Click&gt; https://t.co/AqUoNavSqL #SummerSale #Bossa #Zhivago #sundress #ladies #fashion https://t.co/sybBXuqc5r,"Shops, Deals and Offers",female
450,21595124,https://t.co/yVB0kkb5xh - #dildos &amp; #vibrators of every size shape and color! #sextoys #Ladies #sex #fleshlight… https://t.co/XmVIpfm1Nz,"The Official account for the best online retailer of Sexy #Lingerie, #SexToys, Club Wear, Swim Wear and much more! 18+ #SexLife #SEDUCIBLE #followback",female
451,52241395,Would you take this for a Date?  🤔👫💑 #ladies #repost #fr #date #relationshipgoals #colors #dope https://t.co/LBhSTFa7nT,"CHECK MY LIKES👀THEY POPPIN🤘🔥🗣,🌏Insta-RealJaySavageⓂ️ Snap-SkreamnSavage📸  Moneymaking Savages Only 💰🤑",female
452,1099321946,#ladies who throwin dat AM neck,"More Life, No Dying🌺",female
453,249202257,What’s my life goal you ask? One day be Dan “swagboy” Haig. That guy is the fucking man. #jeep #tattoos #ladies… https://t.co/1O73t1rvfS,🇨🇦,female
454,23335437,#ladies top h&amp;M #united for ever £8.99. #sufc. https://t.co/c5oDnrUd2u,Oldish Malteser back to Homeland..where the sun shines from the heart. .,female
455,349136127,"#Heusenstamm
More! ➡ https://t.co/VrRbX5LUFV
Have you already visited that visitable whore Christina in Heusenstamm… https://t.co/yvSThkHOlb",@mysexyDate24 @mysexyDate24Es @mysexyDate24Fr @mysexyTS24De #WHORES #SLUTS #ESCORT #CLUBS #TS #SHEMALE #TRANSSEXUAL #LADYBOY #XXX #GIRLS #SEXY #SEX #GERMANY,female
456,2843951948,"Womens Ladies Black Faux Fur Mid Wedge Heel Shoes Ankle Boots Size 3,6,7,8 New https://t.co/Wv0Q7KGoM4 #boots… https://t.co/oRAXcd60JQ",I sell womens shoes and boots. #boots #shoes #sandals #highheels #highheel #footwear #womens #ladies #eBay #ebayseller #ebayshop,female
457,620297107,Designed for pleasure https://t.co/h45nOkO4VR #design #love #pleasure #Dildo #ladies #sex #passion #Romance https://t.co/ZqTE1y52bv,Home of pleasurable Toys [https://t.co/or3qUp8Hs9 ] Sexual Wellness Center - Your Key To Enhancing Relationships,female
458,456740546,@TheView #Ladies What about capital punishment? Some innocent people get caught up in it, ,female
459,1225768512,lead_racewear #streetwear #streetwearfashion #urban #art #fashion #ladies #shop #streetstyle… https://t.co/P2DXRSIgOr,"photographer from the south coast. music, product and fashion photography!!",female
460,724403881250164739,My kids are amazing people in spite of me #kids #girls #boys #ladies #Gentleman #Kindness #Smart #thoughtful,"Pilates, music, travel",female
461,912227403472048128,"India's favourite women's online shopping destination @delisinstyle
Now available at https://t.co/J0cbbdr9hl
#delis… https://t.co/OenL874atD",Delisinstyle is a one-stop destination store for all the girls looking for trendy apparel at attractive prices!,female
462,1083053766,#Ladies and their wahala.... Anyways we eat from that. #black #suede #pleat #sandal to rock all… https://t.co/rjpe4dSLvH, ,female
463,848634813305192448,Black silk satin mini with crystal embellishment  Email; couture@lamace.co #couture #fashion #ladies #black #classy… https://t.co/QM4b7zVJfT, ,female
464,2609390197,#Ladies #Fashion Click&gt; https://t.co/jbY9cqiiHq #ladiesclothing #dresses #clothing #celeb https://t.co/57Z94wik04,Shopping and Gambling Offers - Click Below 18+ T&Cs Apply - Please Gamble Responsibly,female
465,747742142588649472,"So, another #Witchhunt &amp; the odious @nadhimzahawi is at the centre of it.

There are a whole LOAD of events which a… https://t.co/Quqt9S0s8G","I drop by now and again because no-one else will listen to me. I know it's Twitter, but if you don't shout at me, I won't shout at you. Deal?",female
466,2264016639,🔥#Adidas #KanyeWest #POWERPHASE #CALABASAS #YEEZY SOUGHTAFTER #FASHION #KANYE #YEEZYCALABASAS #YEZUS… https://t.co/kRm2wnTdwq,"Selling designer clothes,limited edition footwear/collectable sought after items on ebay ""All Genuine"" UK to EUROPE tracked shipping ebay message for WORLDWIDE",female
467,44481763,#Ladies if you're #not doing this for your #man then what are you #even doing??? #LevelUp https://t.co/S6PvKDe4db,"Top notch clothes get the top of the dresser.

zindzim@gmail.com",female
468,837802582311567360,The Saturday Big Tent Wedding Party https://t.co/VDsdpUU4FF #mcallsmith #ladies #alexandermcallsmith #detective #mystery,The very best of books from Scotland - #scottish #books #literature #tartannoir #tourism #travel #scotspirit,female
469,163670353,"#RelationshipSpice: Here is your #Tip for today, #Ladies, Yessss you should #want #it #allllll,… https://t.co/rWk0haj982","Relationship Specialist, Inspiring  Speaker, Counselor, Poet, Upcoming Author",female
470,83877023,It's almost time for the 5th Annual Native Fashion in the City fashion #show! Come check out Native Gorilla and oth… https://t.co/x9xdAjWcEu,"Native Gorilla's mission is to inspire happiness, creativity, spirit and love in a healthy open minded world, through beautiful creative movements!",female
471,57940730,"#LMFAO #LAUGHOFTHEDAY #LADIES ITS OK 😁😁 #LOL
officialplies @plies #hellsnah
#DELIVERTHED**K… https://t.co/qZLlz8536k",JUICEMEDIA FOR ALL YOUR ONLINE/#INTHESTREETS PROMOTIONS ☎️ 561-214-3467 info. juice731@gmail.com,female
472,24955149,#ladies any recommendations on under eye cream?,just a regular girl from Queens.,female
473,717454435421724673,"Hot Sexy Ladies at Vibe Today .  Come Check Us Out!!!
@xoxoFreyja, @valerie_brass, @katrinavibe, candy
#Hot, #Sexy,… https://t.co/19Pfw6xmEn",Established In 2012 VIBE Is Your Discreet Relaxation Retreat In Ottawa East: Where The Hottest Most Genuine MAs In The City Are Found! Feel The Vibe! 6136808059,female
474,2843951948,"Womens Ladies Beige Faux Suede High Heel Party Peep Toe Shoes Size 3,4,5,6,7 New https://t.co/lbpA5ix6Y7 #shoes… https://t.co/aqi3DTRBfv",I sell womens shoes and boots. #boots #shoes #sandals #highheels #highheel #footwear #womens #ladies #eBay #ebayseller #ebayshop,female
475,308687208,"@SenSchumer @TheDemocrats @NancyPelosi @realDonaldTrump @Vp 
#Schumer How do you feel about adding 4 more women to… https://t.co/j6ksQ2bqDd",World Elites and corrupt politicians and Media all in bed together to destroy America. Know ur real enemys,female
476,906213729670483969,"FRENCHIE LASH

Shop the Lash Collection | https://t.co/kf2vL1hBUm or get a free pair when you spend £30.00 or more… https://t.co/zAFPkZjI7O",Womenswear Brand,female
477,19296585,"Deal of the Day:  Lacey Long Sleeve Evening Dress, Free Shipping #Deals #DealoftheDay #Lacey #Eveningdress #Ladies… https://t.co/PexJcZErox","Sears deals, discounts and coupons dished up daily. You can also follow @Sears for information, conversation and more!",female
478,2330824184,"Go Brutal - Born of Ultra
Ladies Lightweight Runner.
£30
#ladies
#run
#running 
#fitness
#training
#teamgb… https://t.co/dZ7K4WgvuN","High Quality Clothing - Born of Ultra.
Est 2014 🎧🇬🇧
#CourageoverFear",female
479,2843951948,"Womens Ladies Blue Faux Suede Wedge Heel Summer Shoes Sandals Size 4,5,6,7,8 New https://t.co/v80eoh5IEq #sandals… https://t.co/yXBvWqmd2D",I sell womens shoes and boots. #boots #shoes #sandals #highheels #highheel #footwear #womens #ladies #eBay #ebayseller #ebayshop,female
480,21254098,For all the #ladies out there interested in a #career in #Engineering. #STEM #internship #WomenInSTEM https://t.co/tvAUov0rqO, ,female
481,3314435958,Best moment in desi ßeAts .. with frndsss # a sexooo kisss with girl @pooja😉@ washroom 😝##mast pub da maja jeevan f… https://t.co/tWr8fuRs6G, ,female
482,821286198551384064,Sleeping in a bra is the worst thing to do for the #breasts. Bra-free #women have about the same incidence of breas… https://t.co/FXHRghNlBu,"you can be healthier than you are right now, only and if you do the right things to keep fit and healthy. follow back and you will never regret.",female
483,75097921,#LADIES Let’s #unite today in solidarity against sexual assault!  Join me in the #BlackOut movement by changing you… https://t.co/abHTdBcUvW,"#lover #fighter #poetrywriter #hardworking #antitrump #shitstarter #tattooed #proudmama I love my country, but it's leadership sucks! #imissobama #theresistance",female
484,14215787,heard a song where @ZacEfron was singing. who knew he could?! dudes got made skills. #ladies be like #omg,Country Music - CEO & Investor - Oilman. Jesus. RaceFan. Golf. Craft Beer. Astronomy. Red Wine. Cigars. Chevy. Between Raising Hell and Amazing Grace,female
485,205936444,"Prom dress chiffon
Message for buying link
$89

#dress #dresses #prom #eveningwear #couture #highschool #partydress… https://t.co/BjqGiOQlaV","Help families earn more income and become properly protected, debt free, and financially independent",female
486,3280322582,Good Morning Everyone! https://t.co/1bWSv9HXjt #business #success #jewelry #motivation #hustle #women #moms… https://t.co/CWjaMYHAev,I am a new consultant with Paparazzi Jewelry/Accessories. All items only cost $5.00. My website is http://t.co/1sPRMnkBa0. Contact me anytime!,female
487,4502764219,We all want to see your Paparazzi! Post picture in comments.  #paparazzi #ladies via https://t.co/91XaE533HU https://t.co/M0OmtoCBGJ, ,female
488,29913185,Ok #ladies #Sluts #Women #pornstars #whatever last time ima ask I’m just curious other than size why do women want… https://t.co/bjo3ei0End,"18 years of age only! Just looking to have fun. In North Tx I am a Happily married 30 year old man, so ladies u have to check with the wife first.",female
489,2693577938,"#Ladies, this is why #Watermelon is the #Latest #Superfood for your #Face - https://t.co/cLXfsQtNdT - https://t.co/QYx8YNYtZT",Crazy Media Club,female
490,39798481,Be kind to yourself today 💘 #Ladies #CMG2018 #Balance #Your🌎 https://t.co/xA4qZ6jqVc,"Mom, Mentor, & Friend │Career Coach │ Curator of Thoughts │ Lover of Life, Books, Food, & Great People│Aspiring Fitness Fanatic & Vegan",female
491,883358363412815873,"Massive Wednesday with THE GOLDEN STAR BAND and VDJ ERIC CORTEZ takes over the decks
#marinesclubofficial… https://t.co/UO4AkynAQy",A place where ROCK and Roll music Brings to LIFE......,female
492,884399271948279808,#Ladies being beautiful ain't enough...,"Financial Superman, money is what I save...",female
493,786654124863553537,Look at this wonderful lot attending our Specialisms event today @NewcastleUtd_FC #Ladies&amp;Gents… https://t.co/tnBnd2iKiY,NTW Medical Development - providing education and CPD to the medical workforce throughout the North East of England and beyond,female
494,877305656461709317,"While you're complimenting yourself today, treat yourself! Link in bio... #nationalcomplimentday #compliments… https://t.co/LZj57vNuq3",Womb & I is a monthly concierge subscription box catering to moms-to-be. Each box has products with mom and babies needs in mind.,female
495,30632529,"Phil Neville apologises for Twitter 'sexism' jokes day after taking Lionesses job.  
Not a good start Phil what cha… https://t.co/nBAjiCADX3", ,female
